{
  "$schema": "https://veritymodchecker.online/data/verity-lookalikes.schema.json",
  "schemaVersion": 1,
  "checkedAt": "2026-07-30T01:10:00+08:00",
  "canonicalUrl": "https://veritymodchecker.online/verity-dweller/",
  "method": "Manual comparison against public Modrinth project APIs and version APIs for similar-name Verity results surfaced in current SERP sampling. These records explain routing confusion; they are not endorsements, safety verdicts, or mirrors.",
  "projects": [
    {
      "name": "Verity Dweller",
      "host": "Modrinth",
      "owner": "Modrinth team zaW97nsy",
      "projectId": "eZW2ZX0U",
      "projectUrl": "https://modrinth.com/mod/verity-dweller",
      "status": "similar-named-fabric-mod-not-verity-je",
      "projectType": "mod",
      "displayedDownloadsAtCheck": 4736,
      "displayedDownloadsApproximate": false,
      "packageType": "jar",
      "minecraftVersion": "26.2",
      "loader": "Fabric",
      "mainFile": "verity-1.0.0.jar",
      "mainFileRecord": "COqUGsQr",
      "mainFileUrl": "https://modrinth.com/mod/verity-dweller/version/COqUGsQr",
      "mainFileDownloadsAtCheck": 616,
      "mainFileSizeBytes": 134255,
      "publishedAt": "2026-07-01",
      "lastUpdate": "2026-07-27",
      "sourceNote": "A separate Fabric mob project that adds a fast spawning Verity-style enemy. It is not the same route as Verity JE Project ID on1Y0osD, CurseForge Project ID 1591438, Bedrock Verity BE, or PnTMC."
    },
    {
      "name": "Horrorland - With Verity!",
      "host": "Modrinth",
      "owner": "Flashh",
      "projectId": "mJcQB7OR",
      "projectUrl": "https://modrinth.com/modpack/horrorland-modpack",
      "status": "separate-modrinth-modpack-with-verity",
      "projectType": "modpack",
      "displayedDownloadsAtCheck": 88242,
      "displayedDownloadsApproximate": false,
      "packageType": "mrpack",
      "minecraftVersion": "1.20.1",
      "loader": "Forge",
      "mainFile": "Horrorland with Verity - MC 1.20.1 9.3.0.mrpack",
      "mainFileRecord": "L0WhiLev",
      "mainFileUrl": "https://modrinth.com/modpack/horrorland-modpack/version/L0WhiLev",
      "mainFileDownloadsAtCheck": 8278,
      "mainFileSizeBytes": 236978823,
      "publishedAt": "2025-09-18",
      "lastUpdate": "2026-07-27",
      "sourceNote": "A separate Modrinth modpack route that includes Verity wording in the title. Use it only when the player intentionally wants that modpack profile, not as a replacement for the standalone Verity Mod Java or Bedrock files."
    },
    {
      "name": "Verity",
      "host": "Modrinth",
      "owner": "AstroGrove",
      "projectId": "DYiZP3fM",
      "projectUrl": "https://modrinth.com/plugin/verity",
      "status": "unrelated-paper-server-plugin-route",
      "projectType": "mod",
      "displayedDownloadsAtCheck": 33261,
      "displayedDownloadsApproximate": false,
      "packageType": "jar",
      "minecraftVersion": "1.21.x",
      "loader": "Paper",
      "mainFile": "Verity-1.7.0.jar",
      "mainFileRecord": "QQ8nARZM",
      "mainFileUrl": "https://modrinth.com/plugin/verity/version/QQ8nARZM",
      "mainFileDownloadsAtCheck": 33261,
      "mainFileSizeBytes": 175039,
      "publishedAt": "2026-01-20",
      "lastUpdate": "2026-01-20",
      "sourceNote": "A Paper server management plugin with the same word in the title. It is not the Minecraft horror Verity Mod download, not Verity JE, and not a Bedrock add-on."
    }
  ],
  "routePolicy": "Use /verity-dweller/ when a search result says Verity Dweller, Horrorland with Verity, or a generic Modrinth Verity plugin and the player needs to know whether it is the same as Verity Mod. Use /download/ for the current standalone Verity JE, Verity BE, PnTMC, and Pocket Edition routes."
}
